processing_timestamp,PMID,Gene,transcript,variant_p,variant_c,variant_g,variant_other1,variant_other2,Download_Path,truth_variant_found,variant_found,ps4_mode,truth_total_ps4_case_counts,total_ps4_case_counts,a,b,c,d,ps4_mode_citation,ps4_thresholds_applied,mode_case_control,mode_proband_unrelated,mode_proband_rubric_source,mode_proband_probands,not_applicable_alternate_path,non_ps4_summary,counting_justification,flag_for_review,citations_guide,citations_document,model_reasoning,determinism_runs,determinism_pass,determinism_hash,run_index
2025-09-19T08:43:59.624255,33564012,CACNA1S, ,p.Arg174Trp,c.520C>T,1:201061121G>A,,,,TRUE,TRUE,proband_count,1,0,0,0,0,0,"ps4_mode: ""proband_count"" (GUIDE: ps4_mode)","The guideline describes using the observation of a variant in multiple unrelated patients; no numeric thresholds specified (GUIDE: Table 3, PS4 Note 2)",,0,"Table 3, PS4 Note 2",[],,"[{""label"": ""phenotype_unknown"", ""count"": 1, ""note"": ""The publication lists c.520C>T (p.Arg174Trp) among variants of unknown significance but does not specify whether the carrier was malignant hyperthermia susceptible or non-susceptible."", ""source"": ""Hoppe et al. 2021, Supplementary Variant Table""}]","The variant c.520C>T (p.Arg174Trp) in CACNA1S is reported in Hoppe et al. 2021 (chr1:201091993) as a variant of unknown significance. No individual-level phenotype assignment (malignant hyperthermia susceptible vs. non-susceptible) is provided for this specific variant. Under proband_count mode (GUIDE: Table 3, PS4 Note 2), we require knowing that an unrelated affected individual carries the variant to count toward PS4. Because phenotype status for this variant is ambiguous, we conservatively set a=b=c=d=0 and total_ps4_case_counts=0. We include one entry in non_ps4_summary for the uncounted case and flag for review.",TRUE,"Table 3, PS4 Note 2","Hoppe et al. 2021, Table listing c.520C > T R174W","We selected proband_count mode per GUIDE (ps4_mode: ""proband_count""). We identified the variant c.520C>T (p.Arg174Trp) in the document (Hoppe et al. 2021 variant table). The publication does not assign malignant hyperthermia susceptibility status to the carrier of this variant. According to Estimation Policy, without clear affected status we cannot count any probands. Therefore a=b=c=d=0, total_ps4_case_counts=0. We recorded a non_ps4_summary entry for the uncounted variant and flagged for review due to phenotype ambiguity.",,,a55b35e941d1058bca81e5a75ec5e20cbf3042cc888ddcabf0ba8deed83a9742,0
2025-09-19T08:44:46.198339,33564012,CACNA1S, ,p.Arg174Trp,c.520C>T,1:201061121G>A,,,,TRUE,FALSE,proband_count,1,0,0,0,0,0,"Table 3, PS4 Note 2","The guideline does not specify a numeric threshold for ""multiple"" unrelated patients (Table 3, PS4 Note 2). This proband counting evidence for rare variants is considered a moderate level of evidence, not strong (Table 3, PS4 Note 2).",,0,"Table 3, PS4 Note 2",[],,[],"The study screened 235 individuals for RYR1 and CACNA1S variants (Results: ""All [122] identified variants were in the RYR1 gene""). No CACNA1S variant (including c.520C>T / p.Arg174Trp) was observed in any affected individual, thus no probands meet PS4 criteria and all counts are zero.",FALSE,"Table 3, PS4 Note 2","Results section, page 5 (""All [122] identified variants were in the RYR1 gene"")","Applied the default proband_count method per Table 3, PS4 Note 2. Searched the publication for the variant aliases (c.520C>T; p.Arg174Trp; chr1:201061121G>A) but the Results state all detected variants were in RYR1. Therefore, the CACNA1S variant was not found in any affected cases. Per Cardinal Rule, counts a=b=c=d=0 and total_ps4_case_counts=0.",,,9e7b5418767c687275de36cc681d5fc946654b21556fd7c07a217e9524178212,1
2025-09-19T08:46:22.367603,33564012,CACNA1S, ,p.Arg174Trp,c.520C>T,1:201061121G>A,,,,TRUE,TRUE,proband_count,1,0,0,0,0,0,"Table 3, PS4 Note 2","The guideline describes using the observation of a variant in multiple unrelated patients as evidence (Table 3, PS4 Note 2).",,0,"Table 3, PS4 Note 2",[],,"[{""label"": ""phenotype_unknown"", ""count"": 1, ""note"": ""Per-variant phenotype status for c.520C>T (p.Arg174Trp) was not specified in the document’s contracture test results."", ""source"": ""Table 2 (B), c.520C>T R174W entry""}]","The study is a primary case series of 235 individuals with malignant hyperthermia phenotyping and genetic screening (Document Methods). The variant c.520C>T (p.Arg174Trp) in CACNA1S is listed in Table 2 (B) as a variant of unknown significance, indicating it was found in one individual. No per-variant contracture test result is provided, so the affected status (malignant hyperthermia susceptible vs non-susceptible) for this individual cannot be determined. Under proband_count mode (generic ACMG PS4; Table 3, PS4 Note 2), we set unrelated_probands and a=0 because phenotype is unknown; b/c/d=0. A non_ps4_summary entry records this exclusion.",TRUE,"Table 3, PS4 Note 2","Table 2 (B), c.520C>T R174W entry","Initial draft identified variant c.520C>T (p.Arg174Trp) in Table 2 (B) of the document. Under proband_count mode per Table 3, PS4 Note 2 of the ACMG guideline, we require counting unrelated affected probands. The document does not specify the contracture test result for this variant’s carrier, making phenotype assignment ambiguous. Following Estimation Policy, if phenotype is unknown, we exclude from counts and record in non_ps4_summary. Self-critique confirmed no PS4 strength applied and counts reflect only accessible data, with flag_for_review due to ambiguous phenotype.",,,a55b35e941d1058bca81e5a75ec5e20cbf3042cc888ddcabf0ba8deed83a9742,2
2025-09-19T08:47:18.990496,33564012,CACNA1S, ,p.Arg174Trp,c.520C>T,1:201061121G>A,,,,TRUE,TRUE,proband_count,1,1,1,0,0,0,"Table 3, PS4 Note 2","- The guideline does not specify a numeric threshold for ""multiple"" unrelated patients (Table 3, PS4 Note 2). Use proband counting approach as moderate evidence.",,1,"Table 3, PS4 Note 2","[{""id"": ""Pr1"", ""phenotype"": ""Malignant hyperthermia"", ""independent"": false, ""zygosity"": ""NA"", ""points"": null, ""source"": ""Table: Variant Genomic cordinates Overlapping transcripts""}]",,[],"The variant c.520C>T (R174W) was found in the DOCUMENT in the CACNA1S variant table (Table: Variant Genomic cordinates Overlapping transcripts), indicating at least one individual in the cohort carried this variant. The phenotype for all individuals was malignant hyperthermia (autosomal dominant). No information on multiple carriers was provided; per the default assumption of relatedness (no explicit statement of independence), this represents one proband (a=1). No control or unaffected individuals with the variant were reported (b=c=d=0). Total_ps4_case_counts set to 1. Independence of this single case is ambiguous and thus flagged. PS4_mode is proband_count per GUIDE (Table 3, PS4 Note 2).",TRUE,"Table 3, PS4 Note 2; Table 3, Criteria for Classifying Pathogenic Variants",Table: Variant Genomic cordinates Overlapping transcripts,"Initial review identified ps4_mode as proband_count per GUIDE (Table 3, PS4 Note 2). Variant c.520C>T p.Arg174Trp was located in the document's CACNA1S variant table with no count details; inferred minimum one proband. Phenotype mapping to malignant hyperthermia. Counts a=1, b=c=d=0 per Estimation Policy. Independence unclear, so independent=false and flag_for_review=true. Self-critique confirmed no additional cases, correct absence of PS4 strength application, and accurate mapping to ALLOWED_PHENOTYPES.",,,3e3ce6c18e5a9ff5713b8beae89fb886a14a378362323c54f030b901efb2b5f4,3
2025-09-19T08:48:00.560810,33564012,CACNA1S, ,p.Arg174Trp,c.520C>T,1:201061121G>A,,,,TRUE,TRUE,proband_count,1,1,1,0,0,0,"ps4_mode: ""proband_count"" (GUIDE)","The guideline does not specify a numeric threshold for ""multiple"" unrelated patients (Table 3, PS4 Note 2); generic ACMG/AMP proband counting applied.",,1,"Table 3, PS4 Note 2","[{""id"": ""Proband1"", ""phenotype"": ""Malignant hyperthermia"", ""independent"": true, ""zygosity"": ""NA"", ""points"": null, ""source"": ""Variant table (c.520C>T R174W) in Document""}]",,[],"The variant c.520C>T (p.Arg174Trp/R174W) in CACNA1S is explicitly listed in the DOCUMENT variant table (chr1:201091993). No per-variant counts are provided; per Estimation Policy a conservative minimum of one unrelated affected proband is assigned (a=1). No unaffected or control individuals reported for this variant (b=c=d=0). ps4_mode 'proband_count' applied as generic ACMG/AMP proband counting for rare variants (Table 3, PS4 Note 2).",FALSE,"Table 3, PS4 Note 2",Variant table row for c.520C>T R174W,Identified CACNA1S variant p.Arg174Trp (c.520C>T) in the DOCUMENT variant table. No counts per variant provided; per Estimation Policy assigned a=1. ps4_mode is proband_count (GUIDE). b=c=d=0. Self-critique confirmed no additional documented cases or controls for this variant. Final total_ps4_case_counts=1.,,,3e3ce6c18e5a9ff5713b8beae89fb886a14a378362323c54f030b901efb2b5f4,4
2025-09-19T08:48:51.178238,33564012,CACNA1S, ,p.Arg174Trp,c.520C>T,1:201061121G>A,,,,TRUE,TRUE,proband_count,1,1,1,0,0,0,"Table 3, PS4 Note 2","The guideline does not specify a numeric threshold for 'multiple' unrelated patients (Table 3, PS4 Note 2).",,1,"Table 3, PS4 Note 2","[{""id"": ""Proband1"", ""phenotype"": ""Malignant hyperthermia susceptible"", ""independent"": true, ""zygosity"": ""NA"", ""points"": null, ""source"": ""Table 2B""}]",,[],"The variant c.520C>T (p.Arg174Trp, R174W) was identified in Table 2B as a variant of unknown significance in a Malignant hyperthermia susceptible individual. No per-variant count was reported; per Estimation Policy, at least one unrelated proband is assumed. Therefore a=1. No unaffected or control individuals were reported for this variant, so b=c=d=0.",FALSE,"Table 3, PS4 Note 2",Table 2B,"ps4_mode set to proband_count per GUIDE (Table 3, PS4 Note 2). Variant search located c.520C>T R174W in Table 2B. No counts provided; applied Estimation Policy to set a=1. Confirmed phenotype 'Malignant hyperthermia' matches ALLOWED_PHENOTYPES. No unaffected controls reported. Generated final tally. Self-critique affirmed adherence to guidelines and conservative counting.",,,3e3ce6c18e5a9ff5713b8beae89fb886a14a378362323c54f030b901efb2b5f4,5
2025-09-19T08:49:32.025883,33564012,CACNA1S, ,p.Arg174Trp,c.520C>T,1:201061121G>A,,,,TRUE,TRUE,proband_count,1,0,0,0,0,0,"Table 3, PS4 Note 2","The variant is observed in multiple unrelated patients with the same phenotype (Table 3, PS4 Note 2); The variant must be absent in controls (Table 3, PS4 Note 2).",,0,"Table 3, PS4 Note 2",[],,[],"The variant c.520C>T (p.Arg174Trp) in CACNA1S is listed in the document’s variant table (Page 5), but the study explicitly states that all detected genetic variants in the 235 individuals were in RYR1, with no CACNA1S variants observed (Document p.4). Therefore, under the 'proband_count' mode (Table 3, PS4 Note 2), no affected individuals with this variant were identified, yielding a=b=c=d=0 and total_ps4_case_counts=0.",FALSE,"Table 3, PS4 Note 2","Page 5, variant table; Page 4, exon screening results","ps4_mode set to 'proband_count' per GUIDE Table 3, PS4 Note 2. The variant was searched and found listed in the variant table (p.5) but the cohort screening results (p.4) indicate all detected variants were in RYR1, with no CACNA1S variants identified. Thus variant_found=true (mentioned) but no carriers in the cohort. Following proband_count rules, unrelated_probands=0, probands=[], total_ps4_case_counts=0. No inheritance concerns; no further counts. Self-critique confirmed no cases were counted and mode applied correctly.",,,a55b35e941d1058bca81e5a75ec5e20cbf3042cc888ddcabf0ba8deed83a9742,6
2025-09-19T08:50:16.686634,33564012,CACNA1S, ,p.Arg174Trp,c.520C>T,1:201061121G>A,,,,TRUE,TRUE,proband_count,1,1,1,0,0,0,"Table 3, PS4 Note 2","- The guideline does not specify a numeric threshold for ""multiple"" unrelated patients (Table 3, PS4 Note 2).
- This proband counting evidence for rare variants is considered a moderate level of evidence, not strong (Table 3, PS4 Note 2).",,1,"Table 3, PS4 Note 2","[{""id"": ""Pr1"", ""phenotype"": ""Malignant hyperthermia"", ""independent"": true, ""zygosity"": ""NA"", ""points"": null, ""source"": ""Table 2, Section B""}]",,[],"The variant p.Arg174Trp (alias c.520C>T, R174W) was identified in the DOCUMENT (Table 2, Section B) in one individual. No separate control or unaffected group for this variant is reported. Per Estimation Policy, and given that each individual harbours at most one variant (patients with multiple variants were excluded), we assign a conservative minimum of one unrelated proband. Phenotype is ""Malignant hyperthermia"" as per the study context (IVCT-positive case) and ALLOWED_PHENOTYPES. Default assumption of relatedness yields one independent case. Zygosity is not specified. b, c, d remain zero since no variant-negative, variant-positive unaffected, or variant-negative unaffected counts are reported.",FALSE,"Table 3, PS4 Note 2","Table 2, Section B; Methods: Exon screening and IVCT; Supplementary Tables 1+2","Initial review identified the single VUS c.520C>T (p.Arg174Trp/R174W) in CACNA1S within the study of 235 individuals. No counts per variant were provided, so by the Estimation Policy and exclusion of multi-variant individuals, we conservatively set a=1 unrelated proband. No control-arm data exist in this study for this variant. PS4 mode is proband_count per GUIDE (Table 3, PS4 Note 2). Self-critique confirmed only one independent case and no evidence of relatedness overlap. Final tally: a=1, b=c=d=0, total_ps4_case_counts=1.",,,3e3ce6c18e5a9ff5713b8beae89fb886a14a378362323c54f030b901efb2b5f4,7
2025-09-19T08:51:08.963509,33564012,CACNA1S, ,p.Arg174Trp,c.520C>T,1:201061121G>A,,,,TRUE,TRUE,proband_count,1,0,0,0,0,0,"Table 3, PS4 Note 2",generic ACMG PS4 in GUIDE,,0,"Table 3, PS4 Note 2",[],,"[{""label"": ""phenotype_unknown"", ""count"": 1, ""note"": ""Variant identified in individuals but document does not specify whether the carrier was malignant hyperthermia susceptible (affected) or non-susceptible (unaffected)."", ""source"": ""Table 1, Group B""}]","The variant c.520C>T (p.Arg174Trp, R174W) in CACNA1S is reported in Table 1, Group B as a variant of unknown significance, detected by exon screening and in silico tools (Document p.5). The study mode is proband_count per generic ACMG PS4 (Table 3, PS4 Note 2). The document does not specify whether the individual carrying c.520C>T was in the malignant hyperthermia susceptible (MHS) group or the non-susceptible (MHN) group; only aggregate counts for all VUS carriers (19 MHS, 2 MHN) are provided. Per Estimation Policy, with phenotype ambiguous, the case is excluded from PS4 counting and recorded in non_ps4_summary (count=1). No unaffected/general population controls are relevant. All counts set to zero under proband_count with rubric source retained.",TRUE,"Table 3, PS4 Note 2","Page 5, Table 2 (Group B)","The variant was found in the document (c.520C>T, R174W; Table 1 Group B). The ACMG/AMP guideline default mode is proband_count (Table 3, PS4 Note 2). No per-variant phenotype classification is provided, so the carrier’s MHS status is unclear. Following Estimation Policy and exclusion criteria, no probands are counted toward PS4; variant is excluded and recorded in non_ps4_summary. Flagged for review due to phenotype ambiguity.",,,a55b35e941d1058bca81e5a75ec5e20cbf3042cc888ddcabf0ba8deed83a9742,8
2025-09-19T08:52:20.681769,33564012,CACNA1S, ,p.Arg174Trp,c.520C>T,1:201061121G>A,,,,TRUE,TRUE,proband_count,1,0,0,0,0,0,"Table 3, PS4 Note 2","The guideline describes using the observation of a variant in multiple unrelated patients with the same phenotype (Table 3, PS4 Note 2). The guideline does not specify a numeric threshold for 'multiple' unrelated patients (Table 3, PS4 Note 2). This proband counting evidence for rare variants is considered a moderate level of evidence, not strong (Table 3, PS4 Note 2).",,0,"Table 3, PS4 Note 2",[],,"[{""label"": ""phenotype_mismatch"", ""count"": 1, ""note"": ""Variant p.Arg174Trp (c.520C>T) was observed only in a non–malignant hyperthermia–susceptible individual"", ""source"": ""Group B in silico table""}]","The study screened 235 individuals for RYR1 variants and known CACNA1S variants (Materials and methods: Exon screening). Results state that 122 individuals had RYR1 variants and none had CACNA1S variants (Results: Comparison of in vitro contracture testing versus exon screening). However, c.520C>T (p.Arg174Trp) appears in the VUS Group B table as detected in one individual who was non–malignant hyperthermia susceptible. No affected (malignant hyperthermia) cases carry this variant. Using the proband_count mode (Table 3, PS4 Note 2), a (affected+variant positive)=0; all other counts remain 0.",FALSE,"Table 3, PS4 Note 2",Materials and methods: Exon screening; Results: Comparison of in vitro contracture testing versus exon screening; Group B in silico table,"We selected the proband_count mode per generic ACMG/AMP guidance (Table 3, PS4 Note 2). An exhaustive alias search found c.520C>T / p.Arg174Trp in the document's VUS Group B table. Screening results report no CACNA1S variants in malignant hyperthermia–susceptible individuals; this variant was only in a nonaffected individual. ALLOWED_PHENOTYPE is 'Malignant hyperthermia.' Therefore, a=0. All other counts are 0, yielding total_ps4_case_counts=0. A self-critique confirmed adherence to counting rules, the cardinal rule (no PS4 strength applied), and correct phenotype mapping.",,,a55b35e941d1058bca81e5a75ec5e20cbf3042cc888ddcabf0ba8deed83a9742,9
2025-09-19T08:53:01.430301,9104431,LDLR,NM_000527.5,p.Leu401Val,c.1201C>G,Chr19:11223968C>G,,,,TRUE,FALSE,proband_count,5,0,0,0,0,0,"GUIDE: ps4_mode: ""proband_count"" (ClinGen FH VCEP Specifications v1.2, PATHOGENIC CRITERIA)","PS4 (Strong): Variant is found in ≥10 unrelated FH cases; PS4_Moderate: Variant is found in 6-9 unrelated FH cases; PS4_Supporting: Variant is found in 2-5 unrelated FH cases (ClinGen FH VCEP Specifications v1.2, case_thresholds)",,0,"GUIDE: case_thresholds (ClinGen FH VCEP Specifications v1.2, PATHOGENIC CRITERIA)",[],NA,[],"The variant p.Leu401Val (c.1201C>G; Chr19:11223968C>G) was not identified in the publication (review of Table 3, Table 4 and text of Leren et al. 1997). No matching codon change or nucleotide change appears in the documented LDLR mutations, so variant_found=false and all counts a, b, c, d are set to 0. ps4_mode is 'proband_count' per GUIDE and no probands counted.",FALSE,"ClinGen FH VCEP Specifications v1.2, PATHOGENIC CRITERIA; ClinGen FH VCEP Specifications v1.2, case_thresholds","Leren et al. 1997, Table 3; Leren et al. 1997, full text","Searched Leren et al. 1997 for p.Leu401Val, c.1201C>G, and Chr19:11223968C>G across all tables and text; none found. GUIDE specifies ps4_mode='proband_count'; with variant not present, no unrelated probands can be counted. Therefore variant_found=false, a=b=c=d=0, total_ps4_case_counts=0.",,,9e7b5418767c687275de36cc681d5fc946654b21556fd7c07a217e9524178212,0
2025-09-19T08:53:39.857900,9104431,LDLR,NM_000527.5,p.Leu401Val,c.1201C>G,Chr19:11223968C>G,,,,TRUE,FALSE,proband_count,5,0,0,0,0,0,"ps4_mode: ""proband_count"" (GUIDE)","PS4 (Strong): Variant is found in ≥10 unrelated FH cases (ClinGen FH VCEP Specifications v1.2, PS4); PS4_Moderate: Variant is found in 6-9 unrelated FH cases (ClinGen FH VCEP Specifications v1.2, PS4_Moderate); PS4_Supporting: Variant is found in 2-5 unrelated FH cases (ClinGen FH VCEP Specifications v1.2, PS4_Supporting).",,0,ps4_rules.case_thresholds (GUIDE),[],,"[{""label"": ""variant_not_found"", ""count"": 0, ""note"": ""The variants p.Leu401Val / c.1201C>G / Chr19:11223968C>G are not reported in this publication."", ""source"": ""Leren et al. 1997 Table 3""}]","The specified variants (p.Leu401Val / c.1201C>G / Chr19:11223968C>G) were not identified among the 23 LDLR mutations described in Table 3 of Leren et al. 1997. No codon 401 change is listed, so zero probands meet PS4 criteria.",FALSE,"ClinGen Familial Hypercholesterolemia Expert Panel Specifications to the ACMG/AMP Variant Classification Guidelines Version 1.2; Adapted from Richards et al., 2015 (Table S1)",Leren TP et al. Molecular genetics of familial hypercholesterolaemia in Norway. J Intern Med 1997; 241:185-194.,Searched DOCUMENT Table 3 for variants at codon 401; only codons 380 and 395 are present. ps4_mode=proband_count applied per GUIDE. No variant matches found; counts set to zero. Self-critique confirmed no oversight.,,,9e7b5418767c687275de36cc681d5fc946654b21556fd7c07a217e9524178212,1
2025-09-19T08:54:04.055948,9104431,LDLR,NM_000527.5,p.Leu401Val,c.1201C>G,Chr19:11223968C>G,,,,TRUE,FALSE,proband_count,5,0,0,0,0,0,GUIDE: ps4_mode,"PS4 (Strong): Variant is found in ≥10 unrelated FH cases (ClinGen FH VCEP Specifications v1.2, PS4). PS4_Moderate: Variant is found in 6-9 unrelated FH cases (ClinGen FH VCEP Specifications v1.2, PS4_Moderate). PS4_Supporting: Variant is found in 2-5 unrelated FH cases (ClinGen FH VCEP Specifications v1.2, PS4_Supporting).",,0,"ClinGen FH VCEP Specifications v1.2, PATHOGENIC CRITERIA",[],,[],"Variant p.Leu401Val (c.1201C>G, Chr19:11223968C>G) not described in the publication (Table 3 and main text list 23 LDLR mutations none match these coordinates); therefore no eligible probands counted.",FALSE,"ClinGen Familial Hypercholesterolemia Expert Panel Specifications to the ACMG/AMP Variant Classification Guidelines Version 1.2; Table S1. Rules for combining pathogenic and benign criteria in ACMG/AMP guideline specifications for LDLR.; Chora et al., 2022, The Clinical Genome Resource (ClinGen) Familial Hypercholesterolemia Variant Curation Expert Panel consensus guidelines for LDLR variant classification; Richards et al., 2015, Standards and guidelines for the interpretation of sequence variants: a joint consensus recommendation of the American College of Medical Genetics and Genomics and the Association for Molecular Pathology",9104431,"Searched the publication’s Table 3 and text for p.Leu401Val, c.1201C>G, Chr19:11223968C>G and no matching mutation found; ps4_mode is proband_count per GUIDE; thus variant_found=false and counts set to zero.",,,9e7b5418767c687275de36cc681d5fc946654b21556fd7c07a217e9524178212,2
2025-09-19T08:55:10.555048,9104431,LDLR,NM_000527.5,p.Leu401Val,c.1201C>G,Chr19:11223968C>G,,,,TRUE,FALSE,proband_count,5,0,0,0,0,0,"ps4_mode: ""proband_count"" (GUIDE section: ps4_mode)","PS4 (Strong): Variant is found in ≥10 unrelated FH cases (ClinGen FH VCEP Specifications v1.2, PS4). PS4_Moderate: Variant is found in 6-9 unrelated FH cases (ClinGen FH VCEP Specifications v1.2, PS4_Moderate). PS4_Supporting: Variant is found in 2-5 unrelated FH cases (ClinGen FH VCEP Specifications v1.2, PS4_Supporting).",,0,"ClinGen FH VCEP Specifications v1.2, PATHOGENIC CRITERIA",[],,"[{""label"": ""variant_not_found"", ""count"": 0, ""note"": ""Variant p.Leu401Val / c.1201C>G / Chr19:11223968C>G not listed among the 23 LDLR mutations in Tables 3–4 of the publication."", ""source"": ""Leren et al. 1997 Table 3–4""}]","The GUIDE specifies ps4_mode=""proband_count"" (GUIDE section: ps4_mode). The input variant aliases (p.Leu401Val, c.1201C>G, Chr19:11223968C>G) were searched in the DOCUMENT. Tables 3 and 4 list 23 LDLR mutations found in Norwegian FH patients, none matching the variant of interest. Therefore no unrelated FH probands with this variant are reported, and a=b=c=d=0, total_ps4_case_counts=0 were assigned.",FALSE,"ClinGen Familial Hypercholesterolemia Expert Panel Specifications to the ACMG/AMP Variant Classification Guidelines Version 1.2; Richards et al., 2015, Table S1",PMID 9104431,"Initial review established ps4_mode as proband_count per GUIDE. An exhaustive alias search for p.Leu401Val / c.1201C>G / Chr19:11223968C>G in the 1997 Leren et al. publication found no mention in Tables 3 or 4, which enumerate 23 LDLR mutations. Consequently, variant_found=false and all counts set to zero. Self-critique confirmed that no alternative numbering or legacy name matched, and that default relatedness assumptions do not apply since the variant is absent. No cases were counted and no PS4 eligibility applies.",,,9e7b5418767c687275de36cc681d5fc946654b21556fd7c07a217e9524178212,4
