processing_timestamp,PMID,Gene,transcript,variant_p,variant_c,variant_g,variant_other1,variant_other2,Download_Path,truth_variant_found,variant_found,ps4_mode,truth_total_ps4_case_counts,total_ps4_case_counts,a,b,c,d,ps4_mode_citation,ps4_thresholds_applied,mode_case_control,mode_proband_unrelated,mode_proband_rubric_source,mode_proband_probands,not_applicable_alternate_path,non_ps4_summary,counting_justification,flag_for_review,citations_guide,citations_document,model_reasoning,determinism_runs,determinism_pass,determinism_hash,run_index
2025-09-19T09:31:40.847845,15154114,SLC6A8,NM_005629.4,p.Pro554Leu,c.1661C>T,,,,,TRUE,TRUE,proband_count,1,1,1,0,0,0,ps4_mode_rationale: The SLC6A8 VCEP has modified the PS4 criterion from a case-control statistical approach to a proband counting system. (GUIDE),"- PS4_Very Strong: 4 or more independent male probands (PS4, Very Strong section).
- PS4_Strong: 3 independent male probands (PS4, Strong section).
- PS4_Moderate: 2 independent male probands (PS4, Moderate section).
- PS4_Supporting: 1 independent male proband (PS4, Supporting section).",,1,"PS4, Supporting section: One independent male proband in addition to any proband used for PP4. Variant must meet PM2_Supporting criterion for PS4 to apply.","[{""id"": ""D11/P1"", ""phenotype"": ""creatine transporter deficiency"", ""independent"": true, ""zygosity"": ""hemizygous"", ""points"": null, ""source"": ""In DNA of the index patient of family D11 (Am. J. Hum. Genet. 75:97–105, 2004), paragraph describing c.1661CrT → p.P554L; Figure 3D""}]",,[],"One male proband (index patient of family D11) was reported with the p.P554L (c.1661C>T) variant and the allowed phenotype 'creatine transporter deficiency' (DOCUMENT Table 1; DNA of index patient of D11). No additional D11 males were described; default assumption of relatedness applies, so only one independent proband is counted. No variant-negative affected or unaffected carriers were reported in this study. Therefore, a=1, b=0, c=0, d=0 under proband_count mode.",FALSE,"ps4_mode_rationale: The SLC6A8 VCEP has modified the PS4 criterion from a case-control statistical approach to a proband counting system. (GUIDE); PS4, Supporting section: One independent male proband in addition to any proband used for PP4. Variant must meet PM2_Supporting criterion for PS4 to apply.","Table 1: g.8883CrT, c.1661CrT, p.P554L for family D11; Text: 'In DNA of the index patient of family D11, a transition of c.1661CrT was detected… The p.P554L mutation segregates with the clinical phenotype within the family (fig. 3D).' (Am. J. Hum. Genet. 75:97–105, 2004)","Identified PS4 mode as proband_count per GUIDE (ps4_mode_rationale). Searched DOCUMENT for 'p.P554L'/'c.1661C>T' and found one index male (family D11). No additional independent probands described; applied default relatedness assumption. No controls or variant-negative cases reported. Populated a=1, b=c=d=0. total_ps4_case_counts=1. No PS4 strength applied. Self-critique confirmed only one independent case; no corrections needed.",,,3e3ce6c18e5a9ff5713b8beae89fb886a14a378362323c54f030b901efb2b5f4,6
2025-09-19T09:32:27.058448,15154114,SLC6A8,NM_005629.4,p.Pro554Leu,c.1661C>T,,,,,TRUE,TRUE,proband_count,1,1,1,0,0,0,ps4_mode in GUIDE,PS4_Very Strong: 4 or more independent male probands with elevated urine creatine/creatinine ratio on one occasion at minimum; PS4_Strong: 3 independent male probands with elevated urine creatine/creatinine ratio on one occasion at minimum; PS4_Moderate: 2 independent male probands with elevated urine creatine/creatinine ratio on one occasion at minimum; PS4_Supporting: 1 independent male proband in addition to any proband used for PP4. (PS4 sections),,1,PS4 section,"[{""id"": ""D11/Pr1"", ""phenotype"": ""creatine transporter deficiency"", ""independent"": true, ""zygosity"": ""hemizygous"", ""points"": null, ""source"": ""Figure 3D; Document text""}]",,[],"One family (D11) reported two affected male siblings with SLC6A8 c.1661C>T (p.P554L). As siblings, they are related, so count as one independent proband (a = 1). No unaffected controls genotyped in this study for this variant (b, c, d = 0). Total_ps4_case_counts = 1. Variant was confirmed absent in 276 controls, meeting PM2_Supporting, but no urine creatine/creatinine ratio was measured; however, raw proband count per ps4_mode is 1.",FALSE,ps4_mode in GUIDE; PS4 sections; ps4_rules,Document text p. 101–102; Figure 3D,"Identified ps4_mode as 'proband_count' per GUIDE (ps4_mode). The variant c.1661C>T (p.P554L) was found in family D11 (Document). Two affected males (siblings) share the variant; under default relatedness, count one independent proband. No control data for this variant, so b, c, d remain zero. Total_ps4_case_counts equals the number of independent probands (1). Self-critique confirmed adherence to count-only requirement and correct application of independence assumption.",,,3e3ce6c18e5a9ff5713b8beae89fb886a14a378362323c54f030b901efb2b5f4,7
2025-09-19T09:32:55.804591,15154114,SLC6A8,NM_005629.4,p.Pro554Leu,c.1661C>T,,,,,TRUE,TRUE,proband_count,1,0,0,0,0,0,ps4_mode_rationale: The SLC6A8 VCEP has modified the PS4 criterion from a case-control statistical approach to a proband counting system (PS4 section).,"PS4_Very Strong: ≥4 probands; PS4_Strong: 3 probands; PS4_Moderate: 2 probands; PS4_Supporting: 1 proband (PS4, case_thresholds).",,0,"PS4, case_thresholds (PS4 section)",[],,"[{""label"": ""ineligible_missing_urine_ratio"", ""count"": 1, ""note"": ""Index patient (Family D11) with p.P554L lacked measurement of elevated urine creatine/creatinine ratio required for PS4 eligibility."", ""source"": ""DOCUMENT, section on p.P554L (Family D11)""}]","ps4_mode=proband_count (per GUIDE ps4_mode_rationale). Variant p.P554L (c.1661C>T) identified in one index male (Family D11) in the publication (Am. J. Hum. Genet. 75:97–105, 2004; section on p.P554L). Inclusion criteria require independent male proband with elevated urinary creatine/creatinine ratio (PS4 section). The D11 index proband lacked urine creatine/creatinine ratio measurement (“lack of appropriate biological material”), thus does not meet PS4 inclusion criteria. No other probands with this variant reported. Variant meets PM2_Supporting per absence in 276 controls but fails phenotype criterion. Therefore a=0; total_ps4_case_counts=0.",FALSE,ps4_mode_rationale: The SLC6A8 VCEP has modified the PS4 criterion from a case-control statistical approach to a proband counting system (PS4 section).; ps4_rules: case_thresholds: PS4_Very Strong: ≥4; PS4_Strong: 3; PS4_Moderate: 2; PS4_Supporting: 1 proband (PS4 section).,"Am. J. Hum. Genet. 75:97–105, 2004; p. D11: Family D11, c.1661C>T, p.P554L; no urine creatine:creatinine data.",Identified ps4_mode as proband_count per GUIDE. Generated VARIANT_ALIASES from input. Searched DOCUMENT for p.P554L (c.1661C>T) found in Family D11. Per inclusion criteria probands must have elevated urinary creatine/creatinine ratio; the D11 proband lacked this measure. No other independent male probands with variant and phenotype. Therefore a=0. No case_control data. non_ps4_summary recorded the ineligible proband. Flag_for_review false. Self-critique confirmed no eligible probands.,,,a55b35e941d1058bca81e5a75ec5e20cbf3042cc888ddcabf0ba8deed83a9742,8
2025-09-19T09:33:44.620331,15154114,SLC6A8,NM_005629.4,p.Pro554Leu,c.1661C>T,,,,,TRUE,TRUE,proband_count,1,0,0,0,0,0,"ps4_mode: ""proband_count"" (GUIDE)","PS4_Very Strong: 4 or more independent male probands; PS4_Strong: 3 independent male probands; PS4_Moderate: 2 independent male probands; PS4_Supporting: 1 independent male proband (PS4, case_thresholds in GUIDE)",,0,"PS4, Supporting section: One independent male proband in addition to any proband used for PP4. Variant must meet PM2_Supporting criterion for PS4 to apply. (GUIDE)",[],,"[{""label"": ""inclusion_criteria_not_met"", ""count"": 1, ""note"": ""PS4 inclusion requires an elevated urine creatine/creatinine ratio; p.P554L proband lacked biochemical measurement."", ""source"": ""DOCUMENT: lack of appropriate biological material for biochemical proof""}]","The variant p.P554L (c.1661C>T) is reported in one index male in family D11 (Table 1; Figure 3D). PS4 inclusion_criteria require an elevated urine creatine/creatinine ratio in each proband (PS4 section of GUIDE). The publication states that no appropriate biological material was available for biochemical confirmation of elevated urine creatine in this family. Therefore, no eligible independent male probands meet PS4 criteria: a=0. No affected individuals without the variant are reported (b=0). No unaffected controls with the variant are reported (c=0). d=0. total_ps4_case_counts=0.",FALSE,"ps4_mode: ""proband_count"" (GUIDE); PS4 section (GUIDE); PS4, Supporting section (GUIDE); case_thresholds in GUIDE","Table 1: g.8883C>T, c.1661C>T, p.P554L (family D11); Figure 3D: pedigree for p.P554L; Text: ""because of the unavailability of biological material ... the pathogenicity could not be studied at the biochemical level""","PS4 mode per GUIDE is proband_count. The variant p.P554L (c.1661C>T) is found in one affected male (family D11). PS4 inclusion_criteria require elevated urine creatine/creatinine ratio, which was not provided for this family. Therefore, no eligible probands can be counted for PS4: a=0, total_ps4_case_counts=0. Counting_justification and non_ps4_summary document the exclusion. Self-critique confirmed adherence to the Cardinal Rule (no PS4 strength applied) and correct application of inclusion criteria.",,,a55b35e941d1058bca81e5a75ec5e20cbf3042cc888ddcabf0ba8deed83a9742,9
2025-09-19T09:35:17.616290,31342592,DICER1,NM_030621.4,p.Leu881Pro,c.2642T>C,,,,,TRUE,TRUE,proband_count,0,1,1,0,0,0,"ClinGen DICER1 VCEP Specifications: “Unrelated probands may contribute up to 1 point each based on phenotype” (PS4, VCEP Specifications to the ACMG/AMP Variant Interpretation Guidelines for DICER1 Version 1.3.0).","1 phenotype point per unrelated proband (PS4, VCEP Specifications).",,1,"ClinGen DICER1 VCEP Specifications to ACMG/AMP Guidelines (PS4, VCEP Specifications)","[{""id"": ""case #778"", ""phenotype"": ""DICER1-related tumor predisposition"", ""independent"": true, ""zygosity"": ""heterozygous germline"", ""points"": null, ""source"": ""Figure 5c""}]",,[],"The variant p.Leu881Pro (c.2642T>C) was documented in Figure 5c as a germline heterozygous change in patient #778. Per the DICER1 VCEP PS4 proband_count mode, each unrelated proband with a DICER1-related tumor predisposition phenotype contributes one point. No other unrelated probands with this variant are present in the publication. No unaffected carriers are reported. Therefore, a = 1, b = 0, c = 0, d = 0, total_ps4_case_counts = 1.",FALSE,"PS4, VCEP Specifications to the ACMG/AMP Variant Interpretation Guidelines for DICER1 Version 1.3.0",Figure 5c,"Identified p.L881P (c.2642T>C) in Figure 5c as a germline DICER1 variant in patient #778. Using proband_count per ClinGen DICER1 VCEP, counted one unrelated heterozygous proband with DICER1-related tumor predisposition. Set a = 1, b/c/d = 0. No thresholds applied; one point per proband. No other instances of this variant found.",,,3e3ce6c18e5a9ff5713b8beae89fb886a14a378362323c54f030b901efb2b5f4,0
2025-09-19T09:36:20.713906,31342592,DICER1,NM_030621.4,p.Leu881Pro,c.2642T>C,,,,,TRUE,TRUE,proband_count,0,1,1,0,0,0,"PS4, VCEP Specifications: ClinGen DICER1 and miRNA-Processing Gene Expert Panel Specifications to the ACMG/AMP Variant Interpretation Guidelines for DICER1 Version 1.3.0","PS4_Supporting: 1 – 1.5 phenotype points (PS4, VCEP Specifications)",,1,"PS4_Supporting: 1 – 1.5 phenotype points (PS4, VCEP Specifications)","[{""id"": ""Case#778"", ""phenotype"": ""cystic nephroma and pineal cyst"", ""independent"": true, ""zygosity"": ""het"", ""points"": null, ""source"": ""Supporting Information Materials, section 3.1 example""}]",,[],"The variant p.Leu881Pro (c.2642T>C) was identified in the germline of a single patient (Case #778) with cystic nephroma at 1.1 years and a pineal cyst (Supporting Information Materials, section 3.1). These are both recognized DICER1-related tumor predisposition phenotypes (ALLOWED_PHENOTYPES). No additional unrelated cases with this variant were reported. No control or unaffected carriers were described. Under proband_count mode (PS4, VCEP specifications), a=1. Default assumption of relatedness applies to families unless stated otherwise; here only one family/proband, so no duplication. b=c=d=0.",FALSE,"PS4, VCEP Specifications: ClinGen DICER1 and miRNA-Processing Gene Expert Panel Specifications to the ACMG/AMP Variant Interpretation Guidelines for DICER1 Version 1.3.0; PS4_Supporting: 1 – 1.5 phenotype points (PS4, VCEP Specifications)","Supporting Information Materials, section 3.1 example","PS4 mode is 'proband_count' per Guide ('PS4, VCEP Specifications'). We searched the document and found p.Leu881Pro (c.2642T>C) described in the functional example (Supporting Information, section 3.1). The patient exhibited two DICER1-associated neoplasms: cystic nephroma and pineal cyst, both within the allowed phenotype. A single unrelated proband was reported. Under 'proband_count', this yields a=1, b=c=d=0, total_ps4_case_counts=1. No PS4 strength applied; only raw tally. The self-critique confirmed correct phenotype mapping, variant identification, and adherence to counting rules with no need for estimation or correction.",,,3e3ce6c18e5a9ff5713b8beae89fb886a14a378362323c54f030b901efb2b5f4,1
2025-09-19T09:37:11.815166,31342592,DICER1,NM_030621.4,p.Leu881Pro,c.2642T>C,,,,,TRUE,TRUE,proband_count,0,1,1,0,0,0,"PS4, VCEP Specifications: ClinGen DICER1 and miRNA-Processing Gene Expert Panel Specifications to the ACMG/AMP Variant Interpretation Guidelines for DICER1 Version 1.3.0","PS4_Strong: ≥4 phenotype points; PS4_Moderate: 2–3.5 phenotype points; PS4_Supporting: 1–1.5 phenotype points (PS4, VCEP Specifications)",,1,"PS4, VCEP Specifications: ClinGen DICER1 and miRNA-Processing Gene Expert Panel Specifications to the ACMG/AMP Variant Interpretation Guidelines for DICER1 Version 1.3.0","[{""id"": ""#778"", ""phenotype"": ""DICER1-related tumor predisposition"", ""independent"": true, ""zygosity"": ""heterozygous"", ""points"": null, ""source"": ""Document section 3.1, “A c.2642T>C (p.L881P) variant was identified in the germline of patient #778 who had cystic nephroma…”""}]",,[],"ps4_mode=proband_count per GUIDE (PS4, VCEP Specifications). Variant aliases c.2642T>C/p.L881P found in de Kock et al. (2019), patient #778, with cystic nephroma (allowed phenotype). No other occurrences. Default assumption: single proband, unrelated. ALLOWED_PHENOTYPES = DICER1-related tumor predisposition. a=1 (1 proband), b=c=d=0. total_ps4_case_counts=1.",FALSE,"PS4, VCEP Specifications: ClinGen DICER1 and miRNA-Processing Gene Expert Panel Specifications to the ACMG/AMP Variant Interpretation Guidelines for DICER1 Version 1.3.0","de Kock L, Wu MK, Foulkes WD. Ten years of DICER1 mutations: Provenance, distribution, and associated phenotypes. Hum Mutat. 2019;40:1939–1953.","Chose ps4_mode=proband_count (GUIDE: PS4 VCEP Specifications). Generated aliases c.2642T>C/p.L881P; located in document p.L881P (case #778). Identified as germline heterozygous. Phenotype cystic nephroma qualifies under ALLOWED_PHENOTYPES. Only one unrelated proband reported, so a=1, b=c=d=0. No exclusions. total_ps4_case_counts=1. Self-critique confirmed single independent case, no overlap or family clustering.",,,3e3ce6c18e5a9ff5713b8beae89fb886a14a378362323c54f030b901efb2b5f4,2
2025-09-19T09:37:56.843234,31342592,DICER1,NM_030621.4,p.Leu881Pro,c.2642T>C,,,,,TRUE,TRUE,proband_count,0,1,1,0,0,0,"PS4, VCEP Specifications: ClinGen DICER1 and miRNA-Processing Gene Expert Panel Specifications to the ACMG/AMP Variant Interpretation Guidelines for DICER1 Version 1.3.0",PS4_Supporting: 1 – 1.5 phenotype points; PS4_Moderate: 2 – 3.5 phenotype points; PS4_Strong: ≥4 phenotype points,,1,"PS4, VCEP Specifications","[{""id"": ""Patient #778"", ""phenotype"": ""CN"", ""independent"": true, ""zygosity"": ""het"", ""points"": null, ""source"": ""Figure 5 caption""}]",,[],"Variant c.2642T>C (p.L881P) is reported in Figure 5 caption as a germline heterozygous alteration in patient #778. The patient presented with cystic nephroma (CN) and pineal cyst. CN is a recognized DICER1-related tumour phenotype (Germline DICER1-related tumour predisposition; ALLOWED_PHENOTYPES). Only one unrelated proband with this variant was identified; no other occurrences of p.L881P are reported. Under the VCEP ps4_mode 'proband_count' (PS4, VCEP Specifications), each unrelated proband with a DICER1-related phenotype contributes up to one point. Therefore, a = 1, b = c = d = 0, total_ps4_case_counts = 1.",FALSE,"PS4, VCEP Specifications: ClinGen DICER1 and miRNA-Processing Gene Expert Panel Specifications to the ACMG/AMP Variant Interpretation Guidelines for DICER1 Version 1.3.0","31342592: Ten years of DICER1 mutations: Provenance, distribution, and associated phenotypes.","Following the GUIDE, ps4_mode='proband_count' (PS4, VCEP Specifications). An exhaustive alias search confirmed 'c.2642T>C' and 'p.L881P' in the document (Figure 5 caption). The variant is germline and heterozygous. The affected phenotype is cystic nephroma, an allowed tumour predisposition phenotype. Only one unrelated proband (#778) carries the variant. Under proband counting, we tally a=1 unrelated affected heterozygote, set b=c=d=0. We did not compute PS4 strength but provided the raw tally. Self-review confirmed correct variant identification, phenotype mapping, and adherence to independence assumption. No controls or unrelated unaffected carriers were reported, so c=d=0. No flags raised.",,,3e3ce6c18e5a9ff5713b8beae89fb886a14a378362323c54f030b901efb2b5f4,3
2025-09-19T09:38:25.601798,31342592,DICER1,NM_030621.4,p.Leu881Pro,c.2642T>C,,,,,TRUE,TRUE,not_applicable,0,0,0,0,0,0,"Secondary-only review article, no new primary case data for PS4",generic ACMG PS4 in GUIDE,,0,NA,[],Secondary-only review article; PS4 not applicable,[],This publication is a comprehensive mutation update/review without new primary case series or case control data for PS4. No new individual-level case counts were generated by the authors; thus PS4 is not applicable and all counts are set to zero.,FALSE,"ClinGen DICER1 VCEP Specifications to ACMG/AMP PS4, proband_count mode",PMID:31342592,"The article is a secondary-only review compiling DICER1 alterations from prior studies. Per workflow, secondary-only publications receive ps4_mode 'not_applicable', and no case or proband counts are tallied. The variant p.Leu881Pro/c.2642T>C was found in Figure 5 and text, but no new primary cohorts were presented.",,,5409c942ecfc6ccad419c9dd5e95a640f709678c1162ff7e1e090afe80e411c3,4
2025-09-19T09:39:12.839455,31342592,DICER1,NM_030621.4,p.Leu881Pro,c.2642T>C,,,,,TRUE,TRUE,proband_count,0,1,1,0,0,0,"PS4, VCEP Specifications: ClinGen DICER1 and miRNA-Processing Gene Expert Panel Specifications to the ACMG/AMP Variant Interpretation Guidelines for DICER1 Version 1.3.0 (PS4, VCEP Specifications)","PS4_Strong: ≥4 phenotype points; PS4_Moderate: 2–3.5 phenotype points; PS4_Supporting: 1–1.5 phenotype points (PS4, VCEP Specifications)",,1,"PS4, VCEP Specifications","[{""id"": ""#778"", ""phenotype"": ""cystic nephroma"", ""independent"": true, ""zygosity"": ""het"", ""points"": null, ""source"": ""Figure 5 description; main text""}]",,[],"One germline heterozygous p.L881P (c.2642T>C) variant was reported in patient #778 with ‘cystic nephroma’ (an allowed DICER1‐related tumor) in the main text/Figure 5 legend. No family members with the same variant were reported; default assumption of unrelatedness applies. Following the Estimation Policy, at least one affected proband carries the variant; therefore, a=1, b=c=d=0. No controls were sequenced for this specific variant in this study.",FALSE,"PS4, VCEP Specifications: ClinGen DICER1 and miRNA-Processing Gene Expert Panel Specifications to the ACMG/AMP Variant Interpretation Guidelines for DICER1 Version 1.3.0; Richards et al., 2015: Standards and Guidelines for the Interpretation of Sequence Variants: A Joint Consensus Recommendation of the ACMG and the Association for Molecular Pathology",31342592,"We set ps4_mode to proband_count per the DICER1 VCEP specifications (PS4, VCEP Specifications). We generated variant aliases including c.2642T>C and p.L881P and located this variant in the document (main text/Figure 5). The patient’s phenotype, cystic nephroma, is an allowed DICER1‐related tumor. No related individuals with the same variant were reported, so the case was counted as one independent proband. No control data were provided for this specific variant, so b=c=d=0. total_ps4_case_counts equals the number of independent probands: 1. A self-review confirmed no other mentions or overlaps and that only counting (not strength assignment) was performed in accordance with the guide.",,,3e3ce6c18e5a9ff5713b8beae89fb886a14a378362323c54f030b901efb2b5f4,5
2025-09-19T09:39:58.096058,31342592,DICER1,NM_030621.4,p.Leu881Pro,c.2642T>C,,,,,TRUE,FALSE,proband_count,0,0,0,0,0,0,"PS4, VCEP Specifications to the ACMG/AMP Variant Interpretation Guidelines for DICER1 (PS4 mode: proband_count)","PS4_Supporting: 1–1.5 points; PS4_Moderate: 2–3.5 points; PS4_Strong: ≥4 points (PS4, VCEP Specifications)",,0,"PS4, VCEP Specifications to the ACMG/AMP Variant Interpretation Guidelines for DICER1",[],,[],"The variant p.Leu881Pro (c.2642T>C) was not found in the provided DOCUMENT (PMID:31342592). No affected or unaffected probands carrying this variant are reported, hence all counts are zero.",FALSE,"PS4, VCEP Specifications to the ACMG/AMP Variant Interpretation Guidelines for DICER1 Version 1.3.0",31342592,"A search of the provided DOCUMENT did not reveal any mention of c.2642T>C or p.Leu881Pro. The PS4 mode as per the GUIDE is 'proband_count'. Since the variant is not documented, variant_found is false and all counts are zero. No probands could be tallied.",,,9e7b5418767c687275de36cc681d5fc946654b21556fd7c07a217e9524178212,6
2025-09-19T09:40:34.707613,31342592,DICER1,NM_030621.4,p.Leu881Pro,c.2642T>C,,,,,TRUE,FALSE,not_applicable,0,0,0,0,0,0,GUIDE: non_ps4_recommendations (VCEP Specifications) – PS4 not applied to secondary‐only literature review/mutation update publications,,,0,,[],Publication is a comprehensive literature review/mutation update; PS4 not applied,"[{""label"": ""secondary_review"", ""count"": 0, ""note"": ""Publication is a secondary‐only mutation update, not primary case ascertainment"", ""source"": ""GUIDE: non_ps4_recommendations""}]","This article is a mutation update summarizing previously published DICER1 variants (secondary‐only literature review). Per GUIDE non_ps4_recommendations, PS4 is not applied to such publications. No primary case/control or proband ascertainment was performed here; thus no variant counts are tallied.",FALSE,non_ps4_recommendations: ClinGen DICER1 VCEP Specifications to the ACMG/AMP Variant Interpretation Guidelines for DICER1 Version 1.3.0,"PMID:31342592; TEN YEARS OF DICER1 MUTATIONS: Provenance, distribution, and associated phenotypes.","Determined the publication to be a secondary‐only mutation update, not a primary case series or case‐control study (per GUIDE non_ps4_recommendations). No counts of unrelated cases or controls are extracted or tallied. Variant p.Leu881Pro/c.2642T>C not newly reported here. PS4 not applicable; all counts set to zero.",,,b95970974e8423a3e4d4b9aa2f9dba978e014960b5419594d928c484493c5466,7
2025-09-19T09:41:04.593670,31342592,DICER1,NM_030621.4,p.Leu881Pro,c.2642T>C,,,,,TRUE,TRUE,proband_count,0,0,0,0,0,0,"ps4_mode_rationale: The DICER1 VCEP has implemented a proband counting system based on phenotype points. The rule specifies that ""Unrelated probands may contribute up to 1 point each based on phenotype"" and the final strength of PS4 is determined by the sum of these points (PS4, VCEP Specifications).","PS4_Strong: ≥4 phenotype points; PS4_Moderate: 2–3.5 phenotype points; PS4_Supporting: 1–1.5 phenotype points (PS4, VCEP Specifications).",,0,"ps4_rules: case_thresholds (PS4, VCEP Specifications)",[],,"[{""label"": ""secondary_only_review"", ""count"": 0, ""note"": ""The publication is a comprehensive mutation update (secondary‐only evidence) with no new individual‐level case ascertainment; per study‐type gate, PS4 is not applied."", ""source"": ""Supporting Materials: Ten years of DICER1 mutations (2019)""}]","The article is a mutation update/review cataloguing previously reported DICER1 variants and tumors (Secondary‐only evidence). There is no new primary case series or case‐control data for p.Leu881Pro/c.2642T>C in this publication. According to the study‐type gate, PS4 counts are set to zero.",FALSE,"ps4_mode_rationale: The DICER1 VCEP has implemented a proband counting system based on phenotype points. (PS4, VCEP Specifications); ps4_rules: case_thresholds: PS4_Strong: ≥4; PS4_Moderate: 2–3.5; PS4_Supporting:1–1.5. (PS4, VCEP Specifications)","Ten years of DICER1 mutations: Provenance, distribution, and associated phenotypes. Leanne de Kock et al. Hum Mutat. 2019;40:1939–1953.","This publication is a comprehensive mutation update (secondary‐only), not presenting any new primary case or control cohorts. Per 'Study‐type gate', secondary‐only evidence yields no PS4 counts. Variant p.Leu881Pro/c.2642T>C was found among catalogued variants (e.g., case #805) but originates from earlier primary reports. No new probands or controls are enumerated here. Counts a,b,c,d are set to zero, total_ps4_case_counts=0.",,,a55b35e941d1058bca81e5a75ec5e20cbf3042cc888ddcabf0ba8deed83a9742,8
